"","arrest_statute","arrest_charge","count"
"1","failure to appear for misdemeanor","843.15(1b)",2
"2","trespassing-fail to leave property","810.09(2b)",2
"3","trespassing-property not structure or convey","810.09(1a)*",2
"4","drive while license suspended 1st offense","322.34(2a)",1
"5","drugs-possess new legend drug wo prescription","499.03",1
"6","larc-petit second conviction","812.014(3b)",1
"7","larc-petit third or subsequent conviction","812.014(3c)",1
"8","lsoa without giving info more than $50 damage","316.061(1)",1
"9","trespassing-property not structure or convey","810.09(2a)",1
