"","arrest_statute","arrest_charge","count"
"1","failure to appear for misdemeanor","843.15(1b)",11
"2","trespassing-property not structure or convey","810.09(2a)",10
"3","trespassing-fail to leave property","810.09(2b)",9
"4","larc-petit first offense","812.014(3a)",5
"5","trespassing-structure or conveyance","810.08(2a)",5
"6","obstruction of public streets wo permit","316.2045(2)",2
"7","trespassing-property not structure or convey","810.09(1a)*",2
"8","petit theft to und 300 dols","812.014(2e)",1
"9","trespassing-occupied structure or conveyance","810.08(2b)",1
