"","arrest_statute","arrest_charge","count"
"1","burg-unoccupied structure","810.02(4)(a)",3
"2","larc-petit third or subsequent conviction","812.014(3c)",3
"3","failure to appear for misdemeanor","843.15(1b)",2
"4","trespassing-property not structure or convey","810.09(1a)*",2
"5","agg battery using deadly weapon","784.045(1a2)",1
"6","damage prop crim misch-200 dollars and under","806.13(1b1)",1
"7","larc-petit first offense","812.014(3a)",1
"8","trespassing-fail to leave property","810.09(2b)",1
"9","trespassing-property not structure or convey","810.09(2a)",1
