"CaseId","Case Number","Jurisdiction","Court Type","Case Status","Case Open Date","Case Close Date","Offense Date","Charge Status","Status Date","Initial Count","Initial Charge Degree","Initial Charge Level","Initial Statute","Initial Charge","Prosecutor Filed Date","Prosecutor Action","Prosecutor Count","Prosecutor Charge Degree","Prosecutor Charge Level","Prosecute Statue","Filed Charge","Court Count","Court Charge Degree","Court Charge Level","Court Statute","Court Charge","Disposition Date","Disposition","Ticket Number","Actual Speed","Posted Speed","Blood Alcohol Level","Vehicle Make","Vehicle Tag","Tag Expiration","DL Number","DL State","School Status","Commercial Vehicle","Haul Hazard","Crash","Bond Issued Date","BondType","Bond Number","Bond Amount","Bond Status","Bond Agency","D6 Status","D6 Issued Date","D6 Released Date","Total Owed","Total Paid","Balance Due","ReOpen Date","ReOpenReason","ReOpen Close Date","Charging Agency","Defense Attorney","Prosecutor Attorney","Judge","First Name","Middle Name","Last Name","Suffix","Date of Birth","Address","City","State","Zip Code","Race","Sex"
840048,"15001098CFMA","ST JOHNS COUNTY - 2     ","Criminal Felony","CLOS","08/06/2015","06/09/2016","02/02/2015","Arrest","08/05/2015",1,"First","Felony","893.13 1c1","SALE OR POSSESSION W/INTENT TO SELL W/IN 1000 FT OF CHILD CARE FACILITY OR SCHOOL","10/09/2015","FILED",1,"First","Felony","893.13 1c1","SALE OR POSSESSION WITH INTENT TO SELL WITHIN 1000 FEET OF CHILD CARE FACILITY OR SCHOOL",1,"First","Felony","893.13 1c1","SALE OR POSSESSION WITH INTENT TO SELL WITHIN 1000 FEET OF CHILD CARE FACILITY OR SCHOOL","06/09/2016","ADJUDICATED GUILTY","",0,0,0.0000,"","",0,"W300-067-77-376-0","FL","",False,False,"No","08/07/2015","Surety","T1050511385",50000.0000,"RELEASED","24/7 IT HAPPENS BAIL BONDS","","          ","          ",668.0000,511.5100,156.4900,"          ","","          ","ST JOHNS COUNTY SHERIFFS OFFICE","RAYMOND EDWARD FORBESS JR","MITCHELL DAVID BISHOP","HOWARD M. MALTZ","BOBBY","EUGENE","WHITTY","","10/16/1977","114 HURST ST ","ST AUGUSTINE","FL","32084","B","M"
840051,"15001099CFMA","ST JOHNS COUNTY - 2     ","Criminal Felony","CLOS","08/06/2015","08/14/2015","08/05/2015","Arrest","08/05/2015",1,"Third","Felony","784.041 2a","DOMESTIC BATTERY BY STRANGULATION","08/14/2015","ANNOUNCEMENT OF NO INFO/NO PETITION",1,"Third","Felony","784.041 2a","DOMESTIC BATTERY BY STRANGULATION",1,"","","","","08/14/2015","","",0,0,0.0000,"","",0,"G650-117-70-964-1","FL","",False,False,"No","08/07/2015","Surety","PSE522957",2500.0000,"RELEASED","STEVE'S BONDING AGENCY, INC","","          ","          ",0.0000,0.0000,0.0000,"          ","","          ","ST JOHNS COUNTY SHERIFFS OFFICE","PUBLIC DEFENDER","","J MICHAEL TRAYNOR","CAROL","SUE","GREEN","","12/24/1970","","","","","W","F"
840051,"15001099CFMA","ST JOHNS COUNTY - 2     ","Criminal Felony","CLOS","08/06/2015","08/14/2015","08/05/2015","Arrest","08/05/2015",2,"First","Misdemeanor","843.02","OBSTRUCT OFFICER WITHOUT VIOLENCE  ","08/14/2015","TRANSFERRED TO ANOTHER COURT",2,"First","Misdemeanor","843.02","OBSTRUCT OFFICER WITHOUT VIOLENCE  ",2,"","","","","08/14/2015","","",0,0,0.0000,"","",0,"G650-117-70-964-1","FL","",False,False,"No","          ","","",0.0000,"","","","          ","          ",0.0000,0.0000,0.0000,"          ","","          ","ST JOHNS COUNTY SHERIFFS OFFICE","PUBLIC DEFENDER","","J MICHAEL TRAYNOR","CAROL","SUE","GREEN","","12/24/1970","","","","","W","F"
840053,"15001100CFMA","ST AUG BEACH - 3","Criminal Felony","CLOS","08/06/2015","08/13/2015","08/05/2015","Arrest","08/05/2015",1,"Third","Felony","322.34 2c","DRIVING WHILE LICENSE CANCELED, SUSPENDED OR REVOKED","08/13/2015","TRANSFERRED TO ANOTHER COURT",1,"Third","Felony","322.34 2c","DRIVING WHILE LICENSE CANCELED, SUSPENDED OR REVOKED",1,"","","","","08/13/2015","","A2PGZ9E",0,0,0.0000,"NISSAN","CVFA84",2006,"M552-830-88-267-0","FL","",False,False,"No","          ","","",0.0000,"","","","          ","          ",0.0000,0.0000,0.0000,"          ","","          ","ST AUGUSTINE BEACH POLICE DEPT","","","J MICHAEL TRAYNOR","THOMAS","JAMES","MANNING","","07/27/1988","2919 TUSCARORA TRIAL APT 81","MIDDLEBURG","FL","32068","W","M"
840053,"15001100CFMA","ST AUG BEACH - 3","Criminal Felony","CLOS","08/06/2015","08/13/2015","08/05/2015","Arrest","08/05/2015",2,"First","Misdemeanor","893.147 1","POSSESSION OF PARAPHERNALIA","08/13/2015","TRANSFERRED TO ANOTHER COURT",2,"First","Misdemeanor","893.147 1","POSSESSION OF PARAPHERNALIA",2,"","","","","08/13/2015","","",0,0,0.0000,"","",0,"M552-830-88-267-0","FL","",False,False,"No","          ","","",0.0000,"","","","          ","          ",0.0000,0.0000,0.0000,"          ","","          ","ST AUGUSTINE BEACH POLICE DEPT","","","J MICHAEL TRAYNOR","THOMAS","JAMES","MANNING","","07/27/1988","2919 TUSCARORA TRIAL APT 81","MIDDLEBURG","FL","32068","W","M"
840114,"15001102CFMA","ST AUG CITY - 1","Criminal Felony","CLOS","08/06/2015","09/30/2015","08/05/2015","Arrest","08/05/2015",1,"Third","Felony","322.34 5","DRIVING WHILE LICENSE REVOKED (HABITUAL)","09/29/2015","TRANSFERRED TO ANOTHER COURT",1,"Third","Felony","322.34 5","DRIVING WHILE LICENSE REVOKED (HABITUAL)",1,"","","","","09/30/2015","","A2JAOAE",0,0,0.0000,"JEEP","CSAK18",2000,"C000-161-62-122-0","FL","",False,False,"No","          ","","",0.0000,"","","","          ","          ",0.0000,0.0000,0.0000,"          ","","          ","ST AUGUSTINE POLICE DEPT","TERRY JON SHOEMAKER","","J MICHAEL TRAYNOR","DAVID","ALAN","CHEWEY","","04/02/1962","5455 1ST ST ","ST AUGUSTINE","FL","32086","W","M"
